{
  "pack_id": "pack-008",
  "pack_name": "Greenfield Tower - Missing Core Documents",
  "quality": "poor",
  "gateway_2_outcome": "failed",
  "notes": "Poor quality with missing core documents including FIRE STRATEGY. More severe than pack-007 which had incomplete docs.",

  "rule_expectations": {
    "SM-001": {"expected_status": "fail", "confidence": "definitive", "reasoning": "Fire Strategy MISSING entirely", "critical": true},
    "SM-002": {"expected_status": "fail", "confidence": "definitive", "reasoning": "No means of escape documentation (fire strategy missing)", "critical": true},
    "SM-003": {"expected_status": "fail", "confidence": "definitive", "reasoning": "No compartmentation info (fire strategy missing)", "critical": true},
    "SM-004": {"expected_status": "fail", "confidence": "definitive", "reasoning": "External wall materials NOT specified anywhere", "critical": true},
    "SM-005": {"expected_status": "fail", "confidence": "definitive", "reasoning": "Sprinklers not mentioned anywhere", "critical": true},
    "SM-006": {"expected_status": "fail", "confidence": "definitive", "reasoning": "No firefighting access documentation", "critical": true},
    "SM-007": {"expected_status": "fail", "confidence": "definitive", "reasoning": "26m building but staircase count not documented", "critical": true},
    "SM-008": {"expected_status": "fail", "confidence": "definitive", "reasoning": "Structural calculations MISSING", "critical": true},
    "SM-009": {"expected_status": "fail", "confidence": "definitive", "reasoning": "Cannot assess alignment - both docs missing", "critical": true},
    "SM-010": {"expected_status": "fail", "confidence": "definitive", "reasoning": "Principal Designer appointment missing", "critical": true},
    "SM-011": {"expected_status": "fail", "confidence": "definitive", "reasoning": "Principal Contractor appointment missing", "critical": true},
    "SM-012": {"expected_status": "fail", "confidence": "definitive", "reasoning": "Golden Thread Strategy missing", "critical": true},
    "SM-013": {"expected_status": "fail", "confidence": "definitive", "reasoning": "Change Control Plan missing", "critical": false},
    "SM-014": {"expected_status": "pass", "confidence": "definitive", "reasoning": "Basic D&A Statement present (one of few docs)", "critical": false},
    "SM-015": {"expected_status": "fail", "confidence": "definitive", "reasoning": "MEP Spec missing", "critical": false},
    "SM-016": {"expected_status": "fail", "confidence": "definitive", "reasoning": "Ventilation Strategy missing", "critical": false},
    "SM-017": {"expected_status": "fail", "confidence": "definitive", "reasoning": "No fire detection specified", "critical": false},
    "SM-018": {"expected_status": "fail", "confidence": "definitive", "reasoning": "No smoke control specified", "critical": false},
    "SM-019": {"expected_status": "fail", "confidence": "definitive", "reasoning": "No evacuation strategy documented", "critical": true},
    "SM-020": {"expected_status": "pass", "confidence": "definitive", "reasoning": "Height 26m stated in application form (consistent in few docs present)", "critical": false},
    "SM-021": {"expected_status": "pass", "confidence": "definitive", "reasoning": "9 storeys consistent in few docs", "critical": false},
    "SM-022": {"expected_status": "fail", "confidence": "definitive", "reasoning": "Fire Risk Assessment missing", "critical": false},
    "SM-023": {"expected_status": "not_applicable", "confidence": "definitive", "reasoning": "Newcastle not London", "critical": false},
    "SM-024": {"expected_status": "not_applicable", "confidence": "definitive", "reasoning": "Not London", "critical": false},
    "SM-025": {"expected_status": "fail", "confidence": "definitive", "reasoning": "Cannot cross-reference - most docs missing", "critical": false},
    "SM-026": {"expected_status": "fail", "confidence": "definitive", "reasoning": "Compliance Statement missing", "critical": false},
    "SM-027": {"expected_status": "fail", "confidence": "definitive", "reasoning": "No version control - few docs present", "critical": false},
    "SM-028": {"expected_status": "fail", "confidence": "definitive", "reasoning": "Construction Control Plan missing", "critical": false},
    "SM-029": {"expected_status": "pass", "confidence": "high", "reasoning": "Basic description in application: 26m, 9 storeys, 110 apartments", "critical": false},
    "SM-030": {"expected_status": "pass", "confidence": "definitive", "reasoning": "Site location in application form", "critical": false},
    "SM-031": {"expected_status": "fail", "confidence": "definitive", "reasoning": "Fire door ratings not specified", "critical": true},
    "SM-032": {"expected_status": "fail", "confidence": "definitive", "reasoning": "Emergency lighting not specified", "critical": false},
    "SM-033": {"expected_status": "fail", "confidence": "definitive", "reasoning": "Fire stopping not documented", "critical": true},
    "SM-034": {"expected_status": "fail", "confidence": "definitive", "reasoning": "Resident communication not addressed", "critical": false},
    "SM-035": {"expected_status": "fail", "confidence": "definitive", "reasoning": "Wayfinding not specified", "critical": false},
    "SM-036": {"expected_status": "fail", "confidence": "definitive", "reasoning": "Dry riser not specified", "critical": true},
    "SM-037": {"expected_status": "fail", "confidence": "definitive", "reasoning": "Balcony fire safety not addressed", "critical": false},
    "SM-038": {"expected_status": "not_applicable", "confidence": "definitive", "reasoning": "No basement mentioned", "critical": false},
    "SM-039": {"expected_status": "not_applicable", "confidence": "definitive", "reasoning": "No car park", "critical": false},
    "SM-040": {"expected_status": "fail", "confidence": "high", "reasoning": "Refuse store not addressed", "critical": false},
    "SM-041": {"expected_status": "fail", "confidence": "definitive", "reasoning": "No competent person schemes", "critical": false},
    "SM-042": {"expected_status": "fail", "confidence": "definitive", "reasoning": "BSM not mentioned", "critical": false},
    "SM-043": {"expected_status": "not_applicable", "confidence": "definitive", "reasoning": "No partial occupation", "critical": false},
    "SM-044": {"expected_status": "fail", "confidence": "definitive", "reasoning": "Specialist competence not addressed", "critical": false},
    "SM-045": {"expected_status": "fail", "confidence": "definitive", "reasoning": "No as-built commitment", "critical": false},
    "SM-046": {"expected_status": "fail", "confidence": "definitive", "reasoning": "No BIM strategy", "critical": false},
    "SM-047": {"expected_status": "fail", "confidence": "definitive", "reasoning": "No drawing revision control", "critical": false},
    "SM-048": {"expected_status": "fail", "confidence": "definitive", "reasoning": "No overheating assessment", "critical": false},
    "SM-049": {"expected_status": "fail", "confidence": "definitive", "reasoning": "Common area ventilation not specified", "critical": false},
    "SM-050": {"expected_status": "fail", "confidence": "definitive", "reasoning": "Kitchen extract not specified", "critical": false},
    "SM-051": {"expected_status": "pass", "confidence": "definitive", "reasoning": "Use C3 stated in application", "critical": false},
    "SM-052": {"expected_status": "pass", "confidence": "definitive", "reasoning": "Address in application", "critical": false},
    "SM-053": {"expected_status": "pass", "confidence": "definitive", "reasoning": "Project name in application", "critical": false},
    "SM-054": {"expected_status": "fail", "confidence": "high", "reasoning": "Design team barely identified", "critical": false},
    "SM-055": {"expected_status": "pass", "confidence": "high", "reasoning": "Few docs present are recent", "critical": false}
  }
}
