{
  "pack_id": "pack-006",
  "pack_name": "Harbour View - Coastal Location",
  "quality": "borderline",
  "gateway_2_outcome": "passed_with_conditions",
  "notes": "Borderline coastal project. Adequate baseline but location-specific risks not fully addressed. Passed with pre-commencement conditions.",

  "rule_expectations": {
    "SM-001": {"expected_status": "pass", "confidence": "high", "reasoning": "Fire strategy present (28 pages), covers core requirements", "critical": true},
    "SM-002": {"expected_status": "pass", "confidence": "definitive", "reasoning": "2 staircases, 18m max travel stated", "critical": true},
    "SM-003": {"expected_status": "pass", "confidence": "definitive", "reasoning": "60-min compartmentation specified", "critical": true},
    "SM-004": {"expected_status": "pass", "confidence": "high", "reasoning": "Non-combustible cladding with corrosion protection for coastal", "critical": true},
    "SM-005": {"expected_status": "pass", "confidence": "definitive", "reasoning": "Sprinklers to BS EN 12845:2015", "critical": true},
    "SM-006": {"expected_status": "pass", "confidence": "high", "reasoning": "Firefighting access with coastal access considerations", "critical": true},
    "SM-007": {"expected_status": "pass", "confidence": "definitive", "reasoning": "21m with 2 staircases", "critical": true},
    "SM-008": {"expected_status": "pass", "confidence": "high", "reasoning": "Structural calcs include wind loading for coastal", "critical": true},
    "SM-009": {"expected_status": "pass", "confidence": "high", "reasoning": "Fire strategy and structural calcs aligned on 60-min", "critical": true},
    "SM-010": {"expected_status": "pass", "confidence": "high", "reasoning": "Principal Designer with coastal project experience", "critical": true},
    "SM-011": {"expected_status": "pass", "confidence": "high", "reasoning": "Principal Contractor with competence evidence", "critical": true},
    "SM-012": {"expected_status": "pass", "confidence": "high", "reasoning": "Golden Thread Strategy present", "critical": true},
    "SM-013": {"expected_status": "pass", "confidence": "definitive", "reasoning": "Change Control Plan present", "critical": false},
    "SM-014": {"expected_status": "pass", "confidence": "definitive", "reasoning": "D&A Statement addressing coastal context", "critical": false},
    "SM-015": {"expected_status": "pass", "confidence": "high", "reasoning": "MEP Spec with corrosion-resistant equipment", "critical": false},
    "SM-016": {"expected_status": "fail", "confidence": "high", "reasoning": "Ventilation strategy lacks detailed coastal wind analysis", "critical": false},
    "SM-017": {"expected_status": "pass", "confidence": "definitive", "reasoning": "Fire alarm L1 system specified", "critical": false},
    "SM-018": {"expected_status": "fail", "confidence": "high", "reasoning": "Smoke control doesn't address high wind conditions at coastal site", "critical": false},
    "SM-019": {"expected_status": "pass", "confidence": "definitive", "reasoning": "Stay put evacuation strategy stated", "critical": true},
    "SM-020": {"expected_status": "pass", "confidence": "definitive", "reasoning": "21m height consistent", "critical": false},
    "SM-021": {"expected_status": "pass", "confidence": "definitive", "reasoning": "7 storeys consistent", "critical": false},
    "SM-022": {"expected_status": "pass", "confidence": "high", "reasoning": "FRA present", "critical": false},
    "SM-023": {"expected_status": "not_applicable", "confidence": "definitive", "reasoning": "Southampton not London", "critical": false},
    "SM-024": {"expected_status": "not_applicable", "confidence": "definitive", "reasoning": "Not London", "critical": false},
    "SM-025": {"expected_status": "fail", "confidence": "high", "reasoning": "Wind calculations not referenced in fire/smoke strategy", "critical": false},
    "SM-026": {"expected_status": "pass", "confidence": "high", "reasoning": "Compliance Statement present", "critical": false},
    "SM-027": {"expected_status": "pass", "confidence": "high", "reasoning": "Version control adequate", "critical": false},
    "SM-028": {"expected_status": "pass", "confidence": "high", "reasoning": "Construction Control Plan present", "critical": false},
    "SM-029": {"expected_status": "pass", "confidence": "definitive", "reasoning": "Building description: 21m, 7 storeys, 80 apartments, coastal", "critical": false},
    "SM-030": {"expected_status": "pass", "confidence": "definitive", "reasoning": "Site location documented with coastal context", "critical": false},
    "SM-031": {"expected_status": "pass", "confidence": "definitive", "reasoning": "FD60 doors specified", "critical": true},
    "SM-032": {"expected_status": "pass", "confidence": "high", "reasoning": "Emergency lighting with corrosion protection", "critical": false},
    "SM-033": {"expected_status": "pass", "confidence": "high", "reasoning": "Fire stopping detailed with marine-grade sealants", "critical": true},
    "SM-034": {"expected_status": "pass", "confidence": "high", "reasoning": "Resident communication addressed", "critical": false},
    "SM-035": {"expected_status": "pass", "confidence": "high", "reasoning": "Wayfinding specified", "critical": false},
    "SM-036": {"expected_status": "pass", "confidence": "definitive", "reasoning": "Dry risers in both staircases", "critical": true},
    "SM-037": {"expected_status": "pass", "confidence": "high", "reasoning": "Balcony fire safety with wind considerations", "critical": false},
    "SM-038": {"expected_status": "not_applicable", "confidence": "definitive", "reasoning": "No basement", "critical": false},
    "SM-039": {"expected_status": "not_applicable", "confidence": "definitive", "reasoning": "No car park", "critical": false},
    "SM-040": {"expected_status": "pass", "confidence": "high", "reasoning": "Refuse store fire safety addressed", "critical": false},
    "SM-041": {"expected_status": "fail", "confidence": "high", "reasoning": "Limited competent person scheme references", "critical": false},
    "SM-042": {"expected_status": "pass", "confidence": "high", "reasoning": "BSM considerations in handover", "critical": false},
    "SM-043": {"expected_status": "not_applicable", "confidence": "definitive", "reasoning": "No partial occupation", "critical": false},
    "SM-044": {"expected_status": "pass", "confidence": "high", "reasoning": "Specialist subcontractor competence mentioned", "critical": false},
    "SM-045": {"expected_status": "pass", "confidence": "high", "reasoning": "As-built documentation commitment", "critical": false},
    "SM-046": {"expected_status": "fail", "confidence": "high", "reasoning": "Basic Golden Thread without BIM", "critical": false},
    "SM-047": {"expected_status": "pass", "confidence": "high", "reasoning": "Drawing revision control adequate", "critical": false},
    "SM-048": {"expected_status": "fail", "confidence": "high", "reasoning": "Overheating assessment doesn't fully address coastal solar gain and wind", "critical": false},
    "SM-049": {"expected_status": "pass", "confidence": "high", "reasoning": "Common area ventilation specified", "critical": false},
    "SM-050": {"expected_status": "pass", "confidence": "high", "reasoning": "Kitchen extract specified", "critical": false},
    "SM-051": {"expected_status": "pass", "confidence": "definitive", "reasoning": "C3 use consistent", "critical": false},
    "SM-052": {"expected_status": "pass", "confidence": "definitive", "reasoning": "Address consistent", "critical": false},
    "SM-053": {"expected_status": "pass", "confidence": "definitive", "reasoning": "Project name consistent", "critical": false},
    "SM-054": {"expected_status": "pass", "confidence": "high", "reasoning": "Design team identified", "critical": false},
    "SM-055": {"expected_status": "pass", "confidence": "definitive", "reasoning": "Documents recent", "critical": false}
  }
}
