{
  "pack_id": "pack-009",
  "pack_name": "Central Plaza - Dangerous Design Choices",
  "quality": "poor",
  "gateway_2_outcome": "failed",
  "notes": "Worst pack - 30m building with only 1 staircase, partial sprinklers, combustible elements, excessive travel distances. Multiple compounding failures.",

  "rule_expectations": {
    "SM-001": {"expected_status": "fail", "confidence": "definitive", "reasoning": "Fire strategy only 15 pages (grossly inadequate for 30m building)", "critical": true},
    "SM-002": {"expected_status": "fail", "confidence": "definitive", "reasoning": "Travel distances 25m (exceed 18m limit) - DANGEROUS", "critical": true},
    "SM-003": {"expected_status": "fail", "confidence": "high", "reasoning": "Compartmentation vague, no clear fire resistance periods", "critical": true},
    "SM-004": {"expected_status": "fail", "confidence": "definitive", "reasoning": "Some ACM combustible cladding on 30m building - DANGEROUS", "critical": true},
    "SM-005": {"expected_status": "fail", "confidence": "definitive", "reasoning": "Sprinklers only in corridors, NOT in apartments (inadequate for 30m residential)", "critical": true},
    "SM-006": {"expected_status": "fail", "confidence": "definitive", "reasoning": "No firefighting lift (required for >18m, definitely for 30m)", "critical": true},
    "SM-007": {"expected_status": "fail", "confidence": "definitive", "reasoning": "Only 1 staircase for 30m residential - CRITICAL FAILURE (need 2 for >18m)", "critical": true},
    "SM-008": {"expected_status": "fail", "confidence": "high", "reasoning": "Structural calcs present but fire section incomplete", "critical": true},
    "SM-009": {"expected_status": "fail", "confidence": "high", "reasoning": "Fire strategy and structural calcs not aligned", "critical": true},
    "SM-010": {"expected_status": "fail", "confidence": "definitive", "reasoning": "Principal Designer is architect without fire safety competence", "critical": true},
    "SM-011": {"expected_status": "fail", "confidence": "high", "reasoning": "Principal Contractor no HRB experience shown", "critical": true},
    "SM-012": {"expected_status": "fail", "confidence": "definitive", "reasoning": "Golden Thread Strategy missing", "critical": true},
    "SM-013": {"expected_status": "fail", "confidence": "definitive", "reasoning": "Change Control Plan missing", "critical": false},
    "SM-014": {"expected_status": "pass", "confidence": "definitive", "reasoning": "D&A Statement present", "critical": false},
    "SM-015": {"expected_status": "fail", "confidence": "definitive", "reasoning": "MEP Spec missing", "critical": false},
    "SM-016": {"expected_status": "fail", "confidence": "definitive", "reasoning": "Ventilation Strategy missing", "critical": false},
    "SM-017": {"expected_status": "fail", "confidence": "high", "reasoning": "Fire detection vaguely mentioned, no system details", "critical": false},
    "SM-018": {"expected_status": "fail", "confidence": "definitive", "reasoning": "No smoke control specified", "critical": false},
    "SM-019": {"expected_status": "fail", "confidence": "high", "reasoning": "Evacuation strategy unclear (inadequate for 1 staircase)", "critical": true},
    "SM-020": {"expected_status": "fail", "confidence": "definitive", "reasoning": "Height inconsistent: 30m vs 28m in different documents", "critical": false},
    "SM-021": {"expected_status": "pass", "confidence": "definitive", "reasoning": "10 storeys consistent", "critical": false},
    "SM-022": {"expected_status": "fail", "confidence": "definitive", "reasoning": "Fire Risk Assessment missing", "critical": false},
    "SM-023": {"expected_status": "not_applicable", "confidence": "definitive", "reasoning": "Cardiff not London", "critical": false},
    "SM-024": {"expected_status": "not_applicable", "confidence": "definitive", "reasoning": "Not London", "critical": false},
    "SM-025": {"expected_status": "fail", "confidence": "high", "reasoning": "Poor document integration", "critical": false},
    "SM-026": {"expected_status": "fail", "confidence": "definitive", "reasoning": "Compliance Statement missing", "critical": false},
    "SM-027": {"expected_status": "fail", "confidence": "high", "reasoning": "Poor version control", "critical": false},
    "SM-028": {"expected_status": "fail", "confidence": "definitive", "reasoning": "Construction Control Plan missing", "critical": false},
    "SM-029": {"expected_status": "pass", "confidence": "high", "reasoning": "Building description present: 30m, 10 storeys, 140 apartments", "critical": false},
    "SM-030": {"expected_status": "pass", "confidence": "definitive", "reasoning": "Site location documented", "critical": false},
    "SM-031": {"expected_status": "fail", "confidence": "high", "reasoning": "Fire door ratings vague", "critical": true},
    "SM-032": {"expected_status": "fail", "confidence": "high", "reasoning": "Emergency lighting not properly specified", "critical": false},
    "SM-033": {"expected_status": "fail", "confidence": "definitive", "reasoning": "Fire stopping not detailed", "critical": true},
    "SM-034": {"expected_status": "fail", "confidence": "high", "reasoning": "Resident communication not addressed", "critical": false},
    "SM-035": {"expected_status": "fail", "confidence": "high", "reasoning": "Wayfinding not specified", "critical": false},
    "SM-036": {"expected_status": "fail", "confidence": "high", "reasoning": "Dry riser mentioned but only 1 (should be in 2 staircases)", "critical": true},
    "SM-037": {"expected_status": "fail", "confidence": "high", "reasoning": "Balcony fire safety not addressed", "critical": false},
    "SM-038": {"expected_status": "not_applicable", "confidence": "definitive", "reasoning": "No basement", "critical": false},
    "SM-039": {"expected_status": "not_applicable", "confidence": "definitive", "reasoning": "No car park", "critical": false},
    "SM-040": {"expected_status": "fail", "confidence": "high", "reasoning": "Refuse store not addressed", "critical": false},
    "SM-041": {"expected_status": "fail", "confidence": "definitive", "reasoning": "No competent person schemes", "critical": false},
    "SM-042": {"expected_status": "fail", "confidence": "definitive", "reasoning": "BSM not mentioned", "critical": false},
    "SM-043": {"expected_status": "not_applicable", "confidence": "definitive", "reasoning": "No partial occupation", "critical": false},
    "SM-044": {"expected_status": "fail", "confidence": "definitive", "reasoning": "Specialist competence not addressed", "critical": false},
    "SM-045": {"expected_status": "fail", "confidence": "definitive", "reasoning": "No as-built commitment", "critical": false},
    "SM-046": {"expected_status": "fail", "confidence": "definitive", "reasoning": "No BIM strategy", "critical": false},
    "SM-047": {"expected_status": "fail", "confidence": "high", "reasoning": "Drawing revision control poor", "critical": false},
    "SM-048": {"expected_status": "fail", "confidence": "definitive", "reasoning": "No overheating assessment", "critical": false},
    "SM-049": {"expected_status": "fail", "confidence": "definitive", "reasoning": "Common area ventilation not specified", "critical": false},
    "SM-050": {"expected_status": "fail", "confidence": "high", "reasoning": "Kitchen extract not specified", "critical": false},
    "SM-051": {"expected_status": "pass", "confidence": "definitive", "reasoning": "Use C3 consistent", "critical": false},
    "SM-052": {"expected_status": "pass", "confidence": "definitive", "reasoning": "Address consistent", "critical": false},
    "SM-053": {"expected_status": "pass", "confidence": "definitive", "reasoning": "Project name consistent", "critical": false},
    "SM-054": {"expected_status": "fail", "confidence": "high", "reasoning": "Design team incompletely identified", "critical": false},
    "SM-055": {"expected_status": "fail", "confidence": "high", "reasoning": "Fire strategy dated over 12 months old", "critical": false}
  }
}
